smartctl version 5.32 Copyright (C) 2002-4 Bruce Allen
Home page is http://smartmontools.sourceforge.net/

=== START OF INFORMATION SECTION ===
Device Model:     FUJITSU MHR2020AT
Serial Number:    NJ13T2215TUH
Firmware Version: 30B8
Device is:        Not in smartctl database [for details use: -P showall]
ATA Version is:   6
ATA Standard is:  ATA/ATAPI-6 T13 1410D revision 1
Local Time is:    Sun Aug 15 13:21:33 2004 MEST
SMART support is: Available - device has SMART capability.
SMART support is: Enabled

=== START OF READ SMART DATA SECTION ===
SMART overall-health self-assessment test result: FAILED!
Drive failure expected in less than 24 hours. SAVE ALL DATA.
See vendor-specific Attribute list for failed Attributes.

General SMART Values:
Offline data collection status:  (0x00)	Offline data collection activity
					was never started.
					Auto Offline Data Collection: Disabled.
Self-test execution status:      ( 105)	The previous self-test completed having
					the servo (and/or seek) element of the 
					test failed.
Total time to complete Offline 
data collection: 		 ( 234) seconds.
Offline data collection
capabilities: 			 (0x1b) SMART execute Offline immediate.
					Auto Offline data collection on/off support.
					Suspend Offline collection upon new
					command.
					Offline surface scan supported.
					Self-test supported.
					No Conveyance Self-test supported.
					No Selective Self-test supported.
SMART capabilities:            (0x0003)	Saves SMART data before entering
					power-saving mode.
					Supports SMART auto save timer.
Error logging capability:        (0x01)	Error logging supported.
					No General Purpose Logging support.
Short self-test routine 
recommended polling time: 	 (   2) minutes.
Extended self-test routine
recommended polling time: 	 (  30) minutes.

SMART Attributes Data Structure revision number: 16
Vendor Specific SMART Attributes with Thresholds:
ID# ATTRIBUTE_NAME          FLAG     VALUE WORST THRESH TYPE      UPDATED  WHEN_FAILED RAW_VALUE
  1 Raw_Read_Error_Rate     0x000f   007   001   046    Pre-fail  Always   FAILING_NOW 154618843423
  2 Throughput_Performance  0x0005   100   100   020    Pre-fail  Offline      -       145
  3 Spin_Up_Time            0x0003   094   083   025    Pre-fail  Always       -       24321
  4 Start_Stop_Count        0x0032   097   097   000    Old_age   Always       -       1887
  5 Reallocated_Sector_Ct   0x0033   099   099   024    Pre-fail  Always       -       1
  7 Seek_Error_Rate         0x000f   100   100   047    Pre-fail  Always       -       458751
  8 Seek_Time_Performance   0x0005   100   100   019    Pre-fail  Offline      -       0
  9 Power_On_Seconds        0x0032   088   088   000    Old_age   Always       -       1819h+16m+52s
 10 Spin_Retry_Count        0x0013   100   100   020    Pre-fail  Always       -       0
 12 Power_Cycle_Count       0x0032   091   091   000    Old_age   Always       -       1467
192 Power-Off_Retract_Count 0x0032   099   099   000    Old_age   Always       -       44
193 Load_Cycle_Count        0x0032   086   086   000    Old_age   Always       -       49810
194 Temperature_Celsius     0x0022   100   100   000    Old_age   Always       -       32
195 Hardware_ECC_Recovered  0x001a   100   100   000    Old_age   Always       -       1221
196 Reallocated_Event_Count 0x0032   099   099   000    Old_age   Always       -       1
197 Current_Pending_Sector  0x0012   001   001   000    Old_age   Always       -       10
198 Offline_Uncorrectable   0x0010   092   092   000    Old_age   Offline      -       17
199 UDMA_CRC_Error_Count    0x003e   200   200   000    Old_age   Always       -       0
200 Multi_Zone_Error_Rate   0x000f   100   100   060    Pre-fail  Always       -       393215
203 Run_Out_Cancel          0x0002   100   100   000    Old_age   Always       -       429515210380

SMART Error Log Version: 1
ATA Error Count: 6861 (device log contains only the most recent five errors)
	CR = Command Register [HEX]
	FR = Features Register [HEX]
	SC = Sector Count Register [HEX]
	SN = Sector Number Register [HEX]
	CL = Cylinder Low Register [HEX]
	CH = Cylinder High Register [HEX]
	DH = Device/Head Register [HEX]
	DC = Device Command Register [HEX]
	ER = Error register [HEX]
	ST = Status register [HEX]
Powered_Up_Time is measured from power on, and printed as
DDd+hh:mm:SS.sss where DD=days, hh=hours, mm=minutes,
SS=sec, and sss=millisec. It "wraps" after 49.710 days.

Error 6861 occurred at disk power-on lifetime: 1818 hours (75 days + 18 hours)
  When the command that caused the error occurred, the device was active or idle.

  After command completion occurred, registers were:
  ER ST SC SN CL CH DH
  -- -- -- -- -- -- --
  40 59 8b 7d 16 51 f0  Error: UNC 139 sectors at LBA = 0x0051167d = 5314173

  Commands leading to the command that caused the error were:
  CR FR SC SN CL CH DH DC   Powered_Up_Time  Command/Feature_Name
  -- -- -- -- -- -- -- --  ----------------  --------------------
  25 00 90 78 16 51 f0 00      08:22:32.857  READ DMA EXT

Error 6860 occurred at disk power-on lifetime: 1818 hours (75 days + 18 hours)
  When the command that caused the error occurred, the device was active or idle.

  After command completion occurred, registers were:
  ER ST SC SN CL CH DH
  -- -- -- -- -- -- --
  40 59 8b 7d 16 51 f0  Error: UNC 139 sectors at LBA = 0x0051167d = 5314173

  Commands leading to the command that caused the error were:
  CR FR SC SN CL CH DH DC   Powered_Up_Time  Command/Feature_Name
  -- -- -- -- -- -- -- --  ----------------  --------------------
  25 00 98 70 16 51 f0 00      08:22:27.700  READ DMA EXT

Error 6859 occurred at disk power-on lifetime: 1818 hours (75 days + 18 hours)
  When the command that caused the error occurred, the device was active or idle.

  After command completion occurred, registers were:
  ER ST SC SN CL CH DH
  -- -- -- -- -- -- --
  40 59 8b 7d 16 51 f0  Error: UNC 139 sectors at LBA = 0x0051167d = 5314173

  Commands leading to the command that caused the error were:
  CR FR SC SN CL CH DH DC   Powered_Up_Time  Command/Feature_Name
  -- -- -- -- -- -- -- --  ----------------  --------------------
  25 00 a0 68 16 51 f0 00      08:22:22.558  READ DMA EXT

Error 6858 occurred at disk power-on lifetime: 1818 hours (75 days + 18 hours)
  When the command that caused the error occurred, the device was active or idle.

  After command completion occurred, registers were:
  ER ST SC SN CL CH DH
  -- -- -- -- -- -- --
  40 59 8b 7d 16 51 f0  Error: UNC 139 sectors at LBA = 0x0051167d = 5314173

  Commands leading to the command that caused the error were:
  CR FR SC SN CL CH DH DC   Powered_Up_Time  Command/Feature_Name
  -- -- -- -- -- -- -- --  ----------------  --------------------
  25 00 a8 60 16 51 f0 00      08:22:17.458  READ DMA EXT

Error 6857 occurred at disk power-on lifetime: 1818 hours (75 days + 18 hours)
  When the command that caused the error occurred, the device was active or idle.

  After command completion occurred, registers were:
  ER ST SC SN CL CH DH
  -- -- -- -- -- -- --
  40 59 8b 7d 16 51 f0  Error: UNC 139 sectors at LBA = 0x0051167d = 5314173

  Commands leading to the command that caused the error were:
  CR FR SC SN CL CH DH DC   Powered_Up_Time  Command/Feature_Name
  -- -- -- -- -- -- -- --  ----------------  --------------------
  25 00 b0 58 16 51 f0 00      08:22:12.558  READ DMA EXT

SMART Self-test log structure revision number 1
Num  Test_Description    Status                  Remaining  LifeTime(hours)  LBA_of_first_error
# 1  Short offline       Completed: servo/seek failure 90%      1819         -
# 2  Extended offline    Completed: servo/seek failure 90%      1816         -

Device does not support Selective Self Tests/Logging
