# smartctl -a /dev/hda
smartctl version 5.0-45 Copyright (C) 2002 Bruce Allen
Home page is http://smartmontools.sourceforge.net/

=== START OF INFORMATION SECTION ===
Device Model:     IC35L120AVV207-0                        
Serial Number:    VNVD02G4G4BDEG
Firmware Version: V24OA63A
ATA Version is:   6
ATA Standard is:  ATA/ATAPI-6 T13 1410D revision 3a
SMART support is: Available - device has SMART capability.
SMART support is: Enabled

=== START OF READ SMART DATA SECTION ===
SMART overall-health self-assessment test result: PASSED

General SMART Values:
Off-line data collection status: (0x00)	Offline data collection activity was
					never started.
Self-test execution status:      (   0)	The previous self-test routine completed
					without error or no self-test has ever 
					been run.
Total time to complete off-line 
data collection: 		 (2855) seconds.
Offline data collection
capabilities: 			 (0x1b) SMART execute Offline immediate.
					Automatic timer ON/OFF support.
					Suspend Offline collection upon new
					command.
					Offline surface scan supported.
					Self-test supported.
SMART capabilities:            (0x0003)	Saves SMART data before entering
					power-saving mode.
					Supports SMART auto save timer.
Error logging capability:        (0x01)	Error logging supported.
Short self-test routine 
recommended polling time: 	 (   1) minutes.
Extended self-test routine 
recommended polling time: 	 (  48) minutes.

SMART Attributes Data Structure revision number: 16
Vendor Specific SMART Attributes with Thresholds:
ID# ATTRIBUTE_NAME          FLAG     VALUE WORST THRESH TYPE     WHEN_FAILED RAW_VALUE
  1 Raw_Read_Error_Rate     0x000b   100   100   060    Pre-fail     -       0
  2 Throughput_Performance  0x0005   100   100   050    Pre-fail     -       0
  3 Spin_Up_Time            0x0007   102   102   024    Pre-fail     -       16974103
  4 Start_Stop_Count        0x0012   100   100   000    Old_age      -       14
  5 Reallocated_Sector_Ct   0x0033   100   100   005    Pre-fail     -       0
  7 Seek_Error_Rate         0x000b   100   100   067    Pre-fail     -       0
  8 Seek_Time_Performance   0x0005   100   100   020    Pre-fail     -       0
  9 Power_On_Hours          0x0012   100   100   000    Old_age      -       242
 10 Spin_Retry_Count        0x0013   100   100   060    Pre-fail     -       0
 12 Power_Cycle_Count       0x0032   100   100   000    Old_age      -       14
192 Power-Off_Retract_Count 0x0032   100   100   050    Old_age      -       24
193 Load_Cycle_Count        0x0012   100   100   050    Old_age      -       24
194 Temperature_Celsius     0x0002   203   203   000    Old_age      -       27 (Lifetime Min/Max 20/37)
196 Reallocated_Event_Count 0x0032   100   100   000    Old_age      -       0
197 Current_Pending_Sector  0x0022   100   100   000    Old_age      -       0
198 Offline_Uncorrectable   0x0008   100   100   000    Old_age      -       0
199 UDMA_CRC_Error_Count    0x000a   200   200   000    Old_age      -       0

SMART Error Log Version: 1
No Errors Logged

SMART Self-test log, version number 1
Num  Test_Description    Status                  Remaining  LifeTime(hours)  LBA_of_first_error
# 1  Extended off-line   Completed                     00%        54         
