smartctl version 5.0-24 Copyright (C) 2002 Bruce Allen
Home page is http://smartmontools.sourceforge.net/

=== START OF INFORMATION SECTION ===
Device Model:     MAXTOR 6L080J4                          
Serial Number:    664201100034        
Firmware Version: A93.0500
ATA Version is:   5
ATA Standard is:  ATA/ATAPI-5 T13 1321D revision 1
SMART support is: Available - device has SMART capability.
SMART support is: Enabled

=== START OF READ SMART DATA SECTION ===
SMART overall-health self-assessment test result: PASSED

General SMART Values:
Off-line data collection status: (0x00)	Offline data collection activity was
					never started.
Self-test execution status:      (   0)	The previous self-test routine completed
					without error or no self-test has ever 
					been run.
Total time to complete off-line 
data collection: 		 (  35) seconds.
Offline data collection
capabilities: 			 (0x1b) SMART execute Offline immediate.
					Automatic timer ON/OFF support.
					Suspend Offline collection upon new
					command.
					Offline surface scan supported.
					Self-test supported.
SMART capabilities:            (0x0003)	Saves SMART data before entering
					power-saving mode.
					Supports SMART auto save timer.
Error logging capability:        (0x01)	Error logging supported.
Short self-test routine 
recommended polling time: 	 (   2) minutes.
Extended self-test routine 
recommended polling time: 	 (  40) minutes.

SMART Attributes Data Structure revision number: 11
Vendor Specific SMART Attributes with Thresholds:
ID# ATTRIBUTE_NAME          FLAG     VALUE WORST THRESH TYPE     WHEN_FAILED RAW_VALUE
  1 Raw_Read_Error_Rate     0x0029   100   253   020    Pre-fail     -       0
  3 Spin_Up_Time            0x0027   069   066   020    Pre-fail     -       3984
  4 Start_Stop_Count        0x0032   100   100   008    Old_age      -       110
  5 Reallocated_Sector_Ct   0x0033   100   100   020    Pre-fail     -       0
  7 Seek_Error_Rate         0x000b   100   100   023    Pre-fail     -       0
  9 Power_On_Hours          0x0012   099   099   001    Old_age      -       1294
 10 Spin_Retry_Count        0x0026   100   100   000    Old_age      -       0
 11 Calibration_Retry_Count 0x0013   100   100   020    Pre-fail     -       0
 12 Power_Cycle_Count       0x0032   100   100   008    Old_age      -       110
 13 Read_Soft_Error_Rate    0x000b   100   100   023    Pre-fail     -       0
194 Temperature_Centigrade  0x0022   092   087   042    Old_age      -       22
195 Hardware_ECC_Recovered  0x001a   100   100   000    Old_age      -       1163
196 Reallocated_Event_Count 0x0010   100   100   020    Old_age      -       0
197 Current_Pending_Sector  0x0032   100   100   020    Old_age      -       0
198 Offline_Uncorrectable   0x0010   100   253   000    Old_age      -       0
199 UDMA_CRC_Error_Count    0x001a   200   200   000    Old_age      -       0

SMART Error Log Version: 1
No Errors Logged

SMART Self-test log, version number 1
Num  Test_Description    Status                  Remaining  LifeTime(hours)  LBA_of_first_error
# 1  Extended off-line   Completed                     00%      1038         
# 2  Extended off-line   Aborted by host               00%       786         
# 3  Extended off-line   Aborted by host               00%       786         
