smartctl version 5.1-4 Copyright (C) 2002 Bruce Allen
Home page is http://smartmontools.sourceforge.net/

=== START OF INFORMATION SECTION ===
Device Model:     MAXTOR 4K080H4                          
Serial Number:    674119114160        
Firmware Version: A08.1500
ATA Version is:   5
ATA Standard is:  ATA/ATAPI-5 T13 1321D revision 1
Local Time is:    Tue May 13 08:59:49 2003 CDT
SMART support is: Available - device has SMART capability.
SMART support is: Enabled

=== START OF READ SMART DATA SECTION ===
SMART overall-health self-assessment test result: FAILED!
Drive failure expected in less than 24 hours. SAVE ALL DATA.
See vendor-specific Attribute list for failed Attributes.

General SMART Values:
Off-line data collection status: (0x82) Offline data collection activity 
                                        completed without error.
Self-test execution status:      ( 112) The previous self-test completed having
                                        the read element of the test failed.
Total time to complete off-line 
data collection:                 (  44) seconds.
Offline data collection
capabilities:                    (0x1b) SMART execute Offline immediate.
                                        Automatic timer ON/OFF support.
                                        Suspend Offline collection upon new
                                        command.
                                        Offline surface scan supported.
                                        Self-test supported.
SMART capabilities:            (0x0003) Saves SMART data before entering
                                        power-saving mode.
                                        Supports SMART auto save timer.
Error logging capability:        (0x01) Error logging supported.
Short self-test routine 
recommended polling time:        (   2) minutes.
Extended self-test routine 
recommended polling time:        (  50) minutes.

SMART Attributes Data Structure revision number: 11
Vendor Specific SMART Attributes with Thresholds:
ID# ATTRIBUTE_NAME          FLAG     VALUE WORST THRESH TYPE     WHEN_FAILED RAW_VALUE
  1 Raw_Read_Error_Rate     0x0029   100   253   020    Pre-fail     -       0
  3 Spin_Up_Time            0x0027   075   075   020    Pre-fail     -       3214
  4 Start_Stop_Count        0x0032   100   100   008    Old_age      -       58
  5 Reallocated_Sector_Ct   0x0033   098   098   020    Pre-fail     -       12
  7 Seek_Error_Rate         0x000b   001   001   023    Pre-fail FAILING_NOW 13
  9 Power_On_Hours          0x0012   078   078   001    Old_age      -       14851
 10 Spin_Retry_Count        0x0026   100   100   000    Old_age      -       0
 11 Calibration_Retry_Count 0x0013   100   090   020    Pre-fail     -       0
 12 Power_Cycle_Count       0x0032   100   100   008    Old_age      -       58
 13 Read_Soft_Error_Rate    0x000b   100   085   023    Pre-fail     -       0
194 Temperature_Celsius     0x0022   091   087   042    Old_age      -       24
195 Hardware_ECC_Recovered  0x001a   004   003   000    Old_age      -       513691822
196 Reallocated_Event_Count 0x0010   099   099   020    Old_age      -       1
197 Current_Pending_Sector  0x0032   098   098   020    Old_age      -       12
198 Offline_Uncorrectable   0x0010   100   100   000    Old_age      -       0
199 UDMA_CRC_Error_Count    0x001a   200   200   000    Old_age      -       0

SMART Error Log Version: 1
ATA Error Count: 25 (device log contains only the most recent five errors)
        DCR = Device Control Register
        FR  = Features Register
        SC  = Sector Count Register
        SN  = Sector Number Register
        CL  = Cylinder Low Register
        CH  = Cylinder High Register
        D/H = Device/Head Register
        CR  = Content written to Command Register
        ER  = Error register
        STA = Status register
Timestamp is seconds since the previous disk power-on.
Note: timestamp "wraps" after 2^32 msec = 49.710 days.

Error 25 occurred at disk power-on lifetime: 14799 hours
When the command that caused the error occurred, the device was in an unknown state.
After command completion occurred, registers were:
ER:40 SC:04 SN:53 CL:1d CH:0c D/H:e0 ST:59
Sequence of commands leading to the command that caused the error were:
DCR   FR   SC   SN   CL   CH   D/H   CR   Timestamp
 0c   00   08   4f   1d   0c    e0   c8     0.523
 0c   00   08   47   1d   0c    e0   c8     510.677
 04   00   08   6f   04   04    e0   ca     510.675
 04   00   08   4f   1c   04    e0   ca     510.674
 04   00   08   6f   04   04    e0   ca     510.674

Error 24 occurred at disk power-on lifetime: 14799 hours
When the command that caused the error occurred, the device was in an unknown state.
After command completion occurred, registers were:
ER:40 SC:03 SN:44 CL:1d CH:0c D/H:e0 ST:59
Sequence of commands leading to the command that caused the error were:
DCR   FR   SC   SN   CL   CH   D/H   CR   Timestamp
 0c   00   08   3f   1d   0c    e0   c8     495.294
 0c   00   08   37   1d   0c    e0   c8     491.239
 0c   00   08   2f   1d   0c    e0   c8     488.433
 14   00   08   17   04   14    e0   ca     488.432
 0c   00   08   b7   00   0c    e0   ca     488.432

Error 23 occurred at disk power-on lifetime: 14799 hours
When the command that caused the error occurred, the device was in an unknown state.
After command completion occurred, registers were:
ER:40 SC:06 SN:21 CL:18 CH:0c D/H:e0 ST:59
Sequence of commands leading to the command that caused the error were:
DCR   FR   SC   SN   CL   CH   D/H   CR   Timestamp
 0c   00   08   1f   18   0c    e0   c8     392.659
 00   00   08   17   18   0c    e0   c8     392.654
 0c   00   08   0f   18   0c    e0   c8     392.624
 00   00   08   07   18   0c    e0   c8     392.620
 00   00   08   ff   17   0c    e0   c8     392.615

Error 22 occurred at disk power-on lifetime: 14799 hours
When the command that caused the error occurred, the device was in an unknown state.
After command completion occurred, registers were:
ER:40 SC:05 SN:b2 CL:16 CH:0c D/H:e0 ST:59
Sequence of commands leading to the command that caused the error were:
DCR   FR   SC   SN   CL   CH   D/H   CR   Timestamp
 0c   00   08   af   16   0c    e0   c8     385.889
 04   00   08   6f   04   04    e0   ca     385.886
 04   00   08   4f   1c   04    e0   ca     385.886
 04   00   08   6f   04   04    e0   ca     385.886
 04   00   08   4f   1c   04    e0   ca     385.885

Error 21 occurred at disk power-on lifetime: 14799 hours
When the command that caused the error occurred, the device was in an unknown state.
After command completion occurred, registers were:
ER:40 SC:06 SN:a9 CL:16 CH:0c D/H:e0 ST:59
Sequence of commands leading to the command that caused the error were:
DCR   FR   SC   SN   CL   CH   D/H   CR   Timestamp
 0c   00   08   a7   16   0c    e0   c8     381.795
 04   00   08   6f   04   04    e0   ca     381.793
 04   00   08   4f   1c   04    e0   ca     381.793
 04   00   08   6f   04   04    e0   ca     381.792
 04   00   08   4f   1c   04    e0   ca     381.792

SMART Self-test log, version number 1
Num  Test_Description    Status                  Remaining  LifeTime(hours)  LBA_of_first_error
# 1  Extended off-line   Completed: read failure       90%     14757         0x000409bb
# 2  Extended off-line   Completed: read failure       90%     14755         0x000bf956
# 3  Extended off-line   Completed                     00%     14305         -
# 4  Extended off-line   Completed                     00%     14100         -
# 5  Extended off-line   Completed                     00%     13721         -
# 6  Extended off-line   Completed                     00%     13636         -
# 7  Extended off-line   Completed                     00%     13233         -
# 8  Extended off-line   Completed                     00%     13078         -
# 9  Extended off-line   Completed                     00%     12093         -
#10  Extended off-line   Completed                     00%     11926         -
#11  Extended off-line   Completed                     00%     11428         -
#12  Extended off-line   Completed                     00%     11030         -
#13  Extended off-line   Completed                     00%     10888         -
#14  Extended off-line   Completed                     00%     10728         -
#15  Extended off-line   Completed                     00%     10435         -
#16  Extended off-line   Completed                     00%     10267         -
#17  Extended off-line   Completed                     00%     10098         -
#18  Extended off-line   Completed                     00%      9930         -
#19  Extended off-line   Completed                     00%      9599         -
