smartctl version 5.0-24 Copyright (C) 2002 Bruce Allen
Home page is http://smartmontools.sourceforge.net/

=== START OF INFORMATION SECTION ===
Device Model:     MAXTOR 4K080H4                          
Serial Number:    674205306226        
Firmware Version: A08.1500
ATA Version is:   5
ATA Standard is:  ATA/ATAPI-5 T13 1321D revision 1
SMART support is: Available - device has SMART capability.
SMART support is: Enabled

=== START OF READ SMART DATA SECTION ===
SMART overall-health self-assessment test result: PASSED

General SMART Values:
Off-line data collection status: (0x02)	Offline data collection activity 
					completed without error.
Self-test execution status:      ( 112)	The previous self-test completed having
					the read element of the test failed.
Total time to complete off-line 
data collection: 		 (  44) seconds.
Offline data collection
capabilities: 			 (0x1b) SMART execute Offline immediate.
					Automatic timer ON/OFF support.
					Suspend Offline collection upon new
					command.
					Offline surface scan supported.
					Self-test supported.
SMART capabilities:            (0x0003)	Saves SMART data before entering
					power-saving mode.
					Supports SMART auto save timer.
Error logging capability:        (0x01)	Error logging supported.
Short self-test routine 
recommended polling time: 	 (   2) minutes.
Extended self-test routine 
recommended polling time: 	 (  50) minutes.

SMART Attributes Data Structure revision number: 11
Vendor Specific SMART Attributes with Thresholds:
ID# ATTRIBUTE_NAME          FLAG     VALUE WORST THRESH TYPE     WHEN_FAILED RAW_VALUE
  1 Raw_Read_Error_Rate     0x0029   100   253   020    Pre-fail     -       0
  3 Spin_Up_Time            0x0027   077   077   020    Pre-fail     -       2909
  4 Start_Stop_Count        0x0032   100   100   008    Old_age      -       29
  5 Reallocated_Sector_Ct   0x0033   100   100   020    Pre-fail     -       1
  7 Seek_Error_Rate         0x000b   100   100   023    Pre-fail     -       0
  9 Power_On_Hours          0x0012   097   097   001    Old_age      -       1992
 10 Spin_Retry_Count        0x0026   100   100   000    Old_age      -       0
 11 Calibration_Retry_Count 0x0013   100   100   020    Pre-fail     -       0
 12 Power_Cycle_Count       0x0032   100   100   008    Old_age      -       29
 13 Read_Soft_Error_Rate    0x000b   100   100   023    Pre-fail     -       0
194 Temperature_Centigrade  0x0022   093   090   042    Old_age      -       19
195 Hardware_ECC_Recovered  0x001a   100   006   000    Old_age      -       7683906
196 Reallocated_Event_Count 0x0010   099   099   020    Old_age      -       1
197 Current_Pending_Sector  0x0032   100   100   020    Old_age      -       1
198 Offline_Uncorrectable   0x0010   100   100   000    Old_age      -       0
199 UDMA_CRC_Error_Count    0x001a   198   198   000    Old_age      -       2

SMART Error Log Version: 1
ATA Error Count: 11 (device log contains only the most recent five errors)
	DCR = Device Control Register
	FR  = Features Register
	SC  = Sector Count Register
	SN  = Sector Number Register
	CL  = Cylinder Low Register
	CH  = Cylinder High Register
	D/H = Device/Head Register
	CR  = Content written to Command Register
	ER  = Error register
	STA = Status register
Timestamp is seconds since the previous disk power-on.
Note: timestamp "wraps" after 2^32 msec = 49.710 days.

Error 1 occurred at disk power-on lifetime: 1029 hours
When the command that caused the error occurred, the device was in an unknown state.
After command completion occurred, registers were:
ER:40 SC:02 SN:41 CL:2d CH:70 D/H:e8 ST:d1
Sequence of commands leading to the command that caused the error were:
DCR   FR   SC   SN   CL   CH   D/H   CR   Timestamp
 70   08   02   41   2d   70    e8   c4     90.713
 70   08   04   3f   2d   70    e8   c4     86.648
 70   08   06   3d   2d   70    e8   c4     82.584
 70   08   08   3b   2d   70    e8   c4     78.342
 28   08   04   8b   2c   28    e8   c5     78.341

Error 2 occurred at disk power-on lifetime: 1029 hours
When the command that caused the error occurred, the device was in an unknown state.
After command completion occurred, registers were:
ER:40 SC:04 SN:3f CL:2d CH:70 D/H:e8 ST:d1
Sequence of commands leading to the command that caused the error were:
DCR   FR   SC   SN   CL   CH   D/H   CR   Timestamp
 70   08   04   3f   2d   70    e8   c4     86.648
 70   08   06   3d   2d   70    e8   c4     82.584
 70   08   08   3b   2d   70    e8   c4     78.342
 28   08   04   8b   2c   28    e8   c5     78.341
 28   08   08   4b   2c   28    e8   c5     78.339

Error 3 occurred at disk power-on lifetime: 1029 hours
When the command that caused the error occurred, the device was in an unknown state.
After command completion occurred, registers were:
ER:40 SC:06 SN:3d CL:2d CH:70 D/H:e8 ST:d1
Sequence of commands leading to the command that caused the error were:
DCR   FR   SC   SN   CL   CH   D/H   CR   Timestamp
 70   08   06   3d   2d   70    e8   c4     82.584
 70   08   08   3b   2d   70    e8   c4     78.342
 28   08   04   8b   2c   28    e8   c5     78.341
 28   08   08   4b   2c   28    e8   c5     78.339
 28   08   08   0b   2c   28    e8   c5     78.338

Error 4 occurred at disk power-on lifetime: 1029 hours
When the command that caused the error occurred, the device was in an unknown state.
After command completion occurred, registers were:
ER:40 SC:08 SN:3b CL:2d CH:70 D/H:e8 ST:d1
Sequence of commands leading to the command that caused the error were:
DCR   FR   SC   SN   CL   CH   D/H   CR   Timestamp
 70   08   08   3b   2d   70    e8   c4     78.342
 28   08   04   8b   2c   28    e8   c5     78.341
 28   08   08   4b   2c   28    e8   c5     78.339
 28   08   08   0b   2c   28    e8   c5     78.338
 28   08   08   cb   2b   28    e8   c5     78.337

Error 5 occurred at disk power-on lifetime: 1029 hours
When the command that caused the error occurred, the device was in an unknown state.
After command completion occurred, registers were:
ER:40 SC:66 SN:41 CL:2d CH:70 D/H:e8 ST:d1
Sequence of commands leading to the command that caused the error were:
DCR   FR   SC   SN   CL   CH   D/H   CR   Timestamp
 70   08   66   41   2d   70    e8   c4     69.020
 70   08   68   3f   2d   70    e8   c4     64.956
 70   08   6a   3d   2d   70    e8   c4     60.891
 70   08   6c   3b   2d   70    e8   c4     56.826
 70   08   fe   a9   2c   70    e8   c4     52.713

SMART Self-test log, version number 1
Num  Test_Description    Status                  Remaining  LifeTime(hours)  LBA_of_first_error
# 1  Extended off-line   Completed: read failure       90%      1965         0x08702f11
# 2  Short off-line      Completed                     00%      1800         
# 3  Short off-line      Completed                     00%      1778         
# 4  Short off-line      Completed                     00%      1777         
