smartctl version 5.1-14 Copyright (C) 2002-3 Bruce Allen
Home page is http://smartmontools.sourceforge.net/

=== START OF INFORMATION SECTION ===
Device Model:     MAXTOR 4K080H4
Serial Number:    674119123112
Firmware Version: A08.1500
Device is:        In smartctl database [for details use: -P show]
ATA Version is:   5
ATA Standard is:  ATA/ATAPI-5 T13 1321D revision 1
Local Time is:    Tue Aug 19 02:06:11 2003 CDT
SMART support is: Available - device has SMART capability.
SMART support is: Enabled

=== START OF READ SMART DATA SECTION ===
SMART overall-health self-assessment test result: FAILED!
Drive failure expected in less than 24 hours. SAVE ALL DATA.
See vendor-specific Attribute list for failed Attributes.

General SMART Values:
Off-line data collection status: (0x80)	Offline data collection activity was
					never started.
					Auto Off-line Data Collection: Enabled.
Self-test execution status:      (   0)	The previous self-test routine completed
					without error or no self-test has ever 
					been run.
Total time to complete off-line 
data collection: 		 (  44) seconds.
Offline data collection
capabilities: 			 (0x1b) SMART execute Offline immediate.
					Automatic timer ON/OFF support.
					Suspend Offline collection upon new
					command.
					Offline surface scan supported.
					Self-test supported.
					No Conveyance Self-test supported.
					No Selective Self-test supported.
SMART capabilities:            (0x0003)	Saves SMART data before entering
					power-saving mode.
					Supports SMART auto save timer.
Error logging capability:        (0x01)	Error logging supported.
					No General Purpose Logging support.
Short self-test routine 
recommended polling time: 	 (   2) minutes.
Extended self-test routine 
recommended polling time: 	 (  50) minutes.

SMART Attributes Data Structure revision number: 11
Vendor Specific SMART Attributes with Thresholds:
ID# ATTRIBUTE_NAME          FLAG     VALUE WORST THRESH TYPE      UPDATED  WHEN_FAILED RAW_VALUE
  1 Raw_Read_Error_Rate     0x0029   100   253   020    Pre-fail  Offline      -       0
  3 Spin_Up_Time            0x0027   075   074   020    Pre-fail  Always       -       3186
  4 Start_Stop_Count        0x0032   100   100   008    Old_age   Always       -       68
  5 Reallocated_Sector_Ct   0x0033   100   100   020    Pre-fail  Always       -       0
  7 Seek_Error_Rate         0x000b   100   100   023    Pre-fail  Always       -       0
  9 Power_On_Hours          0x0012   074   074   001    Old_age   Always       -       17202
 10 Spin_Retry_Count        0x0026   100   100   000    Old_age   Always       -       0
 11 Calibration_Retry_Count 0x0013   010   010   020    Pre-fail  Always   FAILING_NOW 9
 12 Power_Cycle_Count       0x0032   100   100   008    Old_age   Always       -       68
 13 Read_Soft_Error_Rate    0x000b   100   100   023    Pre-fail  Always       -       0
194 Temperature_Celsius     0x0022   092   087   042    Old_age   Always       -       22
195 Hardware_ECC_Recovered  0x001a   018   003   000    Old_age   Always       -       1082933060
196 Reallocated_Event_Count 0x0010   100   100   020    Old_age   Offline      -       0
197 Current_Pending_Sector  0x0032   100   100   020    Old_age   Always       -       0
198 Offline_Uncorrectable   0x0010   100   253   000    Old_age   Offline      -       0
199 UDMA_CRC_Error_Count    0x001a   200   200   000    Old_age   Always       -       0

SMART Error Log Version: 1
No Errors Logged

SMART Self-test log, version number 1
Num  Test_Description    Status                  Remaining  LifeTime(hours)  LBA_of_first_error
# 1  Extended off-line   Completed                     00%     17157         -
# 2  Extended off-line   Completed                     00%     16990         -
# 3  Extended off-line   Completed                     00%     16823         -
# 4  Extended off-line   Completed                     00%     16657         -
# 5  Extended off-line   Completed                     00%     16598         -
# 6  Extended off-line   Completed                     00%     16490         -
# 7  Extended off-line   Completed                     00%     16323         -
# 8  Extended off-line   Completed                     00%     16157         -
# 9  Extended off-line   Completed                     00%     15991         -
#10  Extended off-line   Completed                     00%     15696         -
#11  Extended off-line   Completed                     00%     15614         -
#12  Extended off-line   Completed                     00%     15241         -
#13  Extended off-line   Completed                     00%     15026         -
#14  Extended off-line   Completed                     00%     14785         -
#15  Extended off-line   Completed                     00%     14334         -
#16  Extended off-line   Completed                     00%     14129         -
#17  Extended off-line   Completed                     00%     13750         -
#18  Extended off-line   Completed                     00%     13665         -
#19  Extended off-line   Completed                     00%     13262         -
#20  Extended off-line   Completed                     00%     13108         -
#21  Extended off-line   Completed                     00%     12125         -

