smartctl version 5.22 Copyright (C) 2002-3 Bruce Allen
Home page is http://smartmontools.sourceforge.net/

=== START OF INFORMATION SECTION ===
Device Model:     MAXTOR 4K080H4
Serial Number:    674119014987
Firmware Version: A08.1500
Device is:        In smartctl database [for details use: -P show]
ATA Version is:   5
ATA Standard is:  ATA/ATAPI-5 T13 1321D revision 1
Local Time is:    Mon Oct 27 14:30:17 2003 CST
SMART support is: Available - device has SMART capability.
SMART support is: Enabled

=== START OF READ SMART DATA SECTION ===
SMART overall-health self-assessment test result: PASSED

General SMART Values:
Offline data collection status:  (0x80)	Offline data collection activity was
					never started.
					Auto Offline Data Collection: Enabled.
Self-test execution status:      ( 112)	The previous self-test completed having
					the read element of the test failed.
Total time to complete Offline 
data collection: 		 (  44) seconds.
Offline data collection
capabilities: 			 (0x1b) SMART execute Offline immediate.
					Auto Offline data collection on/off support.
					Suspend Offline collection upon new
					command.
					Offline surface scan supported.
					Self-test supported.
					No Conveyance Self-test supported.
					No Selective Self-test supported.
SMART capabilities:            (0x0003)	Saves SMART data before entering
					power-saving mode.
					Supports SMART auto save timer.
Error logging capability:        (0x01)	Error logging supported.
					No General Purpose Logging support.
Short self-test routine 
recommended polling time: 	 (   2) minutes.
Extended self-test routine
recommended polling time: 	 (  50) minutes.

SMART Attributes Data Structure revision number: 11
Vendor Specific SMART Attributes with Thresholds:
ID# ATTRIBUTE_NAME          FLAG     VALUE WORST THRESH TYPE      UPDATED  WHEN_FAILED RAW_VALUE
  1 Raw_Read_Error_Rate     0x0029   100   253   020    Pre-fail  Offline      -       0
  3 Spin_Up_Time            0x0027   075   074   020    Pre-fail  Always       -       3135
  4 Start_Stop_Count        0x0032   100   100   008    Old_age   Always       -       54
  5 Reallocated_Sector_Ct   0x0033   098   097   020    Pre-fail  Always       -       14
  7 Seek_Error_Rate         0x000b   100   100   023    Pre-fail  Always       -       0
  9 Power_On_Hours          0x0012   072   072   001    Old_age   Always       -       18875
 10 Spin_Retry_Count        0x0026   100   100   000    Old_age   Always       -       0
 11 Calibration_Retry_Count 0x0013   100   100   020    Pre-fail  Always       -       0
 12 Power_Cycle_Count       0x0032   100   100   008    Old_age   Always       -       53
 13 Read_Soft_Error_Rate    0x000b   100   085   023    Pre-fail  Always       -       0
194 Temperature_Celsius     0x0022   093   088   042    Old_age   Always       -       20
195 Hardware_ECC_Recovered  0x001a   028   002   000    Old_age   Always       -       1472864733
196 Reallocated_Event_Count 0x0010   100   099   020    Old_age   Offline      -       0
197 Current_Pending_Sector  0x0032   100   100   020    Old_age   Always       -       2
198 Offline_Uncorrectable   0x0010   100   100   000    Old_age   Offline      -       0
199 UDMA_CRC_Error_Count    0x001a   200   200   000    Old_age   Always       -       0

SMART Error Log Version: 1
ATA Error Count: 28 (device log contains only the most recent five errors)
	CR = Command Register [HEX]
	FR = Features Register [HEX]
	SC = Sector Count Register [HEX]
	SN = Sector Number Register [HEX]
	CL = Cylinder Low Register [HEX]
	CH = Cylinder High Register [HEX]
	DH = Device/Head Register [HEX]
	DC = Device Command Register [HEX]
	ER = Error register [HEX]
	ST = Status register [HEX]
Timestamp = decimal seconds since the previous disk power-on.
Note: timestamp "wraps" after 2^32 msec = 49.710 days.

Error 28 occurred at disk power-on lifetime: 18785 hours
  When the command that caused the error occurred, the device was in an unknown state.

  After command completion occurred, registers were:
  ER ST SC SN CL CH DH
  -- -- -- -- -- -- --
  40 d1 38 ce 8f 40 e0  Error: UNC

  Commands leading to the command that caused the error were:
  CR FR SC SN CL CH DH DC   Timestamp  Command/Feature_Name
  -- -- -- -- -- -- -- --   ---------  --------------------
  c8 00 38 ce 8f 40 e0 40     315.769  READ DMA
  c8 00 40 c6 8f 40 e0 40     311.634  READ DMA
  b0 00 01 01 4f c2 e0 1f     284.485  [Reserved SMART command]
  b0 00 01 06 4f c2 e0 34     284.470  [Reserved SMART command]
  b0 00 01 00 4f c2 e0 34     284.399  [Reserved SMART command]

Error 27 occurred at disk power-on lifetime: 18785 hours
  When the command that caused the error occurred, the device was in an unknown state.

  After command completion occurred, registers were:
  ER ST SC SN CL CH DH
  -- -- -- -- -- -- --
  40 59 38 ce 8f 40 e0  Error: UNC

  Commands leading to the command that caused the error were:
  CR FR SC SN CL CH DH DC   Timestamp  Command/Feature_Name
  -- -- -- -- -- -- -- --   ---------  --------------------
  c8 00 40 c6 8f 40 e0 40     311.634  READ DMA
  b0 00 01 01 4f c2 e0 1f     284.485  [Reserved SMART command]
  b0 00 01 06 4f c2 e0 34     284.470  [Reserved SMART command]
  b0 00 01 00 4f c2 e0 34     284.399  [Reserved SMART command]
  b0 00 00 00 4f c2 00 34     284.328  [Reserved SMART command]

Error 26 occurred at disk power-on lifetime: 18744 hours
  When the command that caused the error occurred, the device was in an unknown state.

  After command completion occurred, registers were:
  ER ST SC SN CL CH DH
  -- -- -- -- -- -- --
  40 d1 08 bf 00 30 e0  Error: UNC

  Commands leading to the command that caused the error were:
  CR FR SC SN CL CH DH DC   Timestamp  Command/Feature_Name
  -- -- -- -- -- -- -- --   ---------  --------------------
  c8 00 08 bf 00 30 e0 30     134.258  READ DMA
  c8 00 08 cf 3d 34 e0 34     134.247  READ DMA
  c8 00 08 af 00 34 e0 34     134.215  READ DMA
  c8 00 28 6f 3e 28 e0 28     134.213  READ DMA
  c8 00 08 67 3e 28 e0 28     134.201  READ DMA

Error 25 occurred at disk power-on lifetime: 18619 hours
  When the command that caused the error occurred, the device was in an unknown state.

  After command completion occurred, registers were:
  ER ST SC SN CL CH DH
  -- -- -- -- -- -- --
  40 59 07 89 67 10 e3  Error: UNC

  Commands leading to the command that caused the error were:
  CR FR SC SN CL CH DH DC   Timestamp  Command/Feature_Name
  -- -- -- -- -- -- -- --   ---------  --------------------
  c8 03 08 88 67 10 e3 10      54.493  READ DMA
  c8 03 08 88 69 08 e3 08      54.483  READ DMA
  c8 03 08 88 67 08 e3 08      54.471  READ DMA
  c8 02 08 88 69 ec e2 ec      54.464  READ DMA
  c8 02 08 88 67 ec e2 ec      54.439  READ DMA

Error 24 occurred at disk power-on lifetime: 18619 hours
  When the command that caused the error occurred, the device was in an unknown state.

  After command completion occurred, registers were:
  ER ST SC SN CL CH DH
  -- -- -- -- -- -- --
  40 59 06 8a 67 0c e2  Error: UNC

  Commands leading to the command that caused the error were:
  CR FR SC SN CL CH DH DC   Timestamp  Command/Feature_Name
  -- -- -- -- -- -- -- --   ---------  --------------------
  c8 02 08 88 67 0c e2 0c      49.281  READ DMA
  c8 02 08 88 69 08 e2 08      49.270  READ DMA
  c8 02 08 88 69 04 e2 04      49.259  READ DMA
  c8 02 08 88 69 00 e2 00      49.257  READ DMA
  c8 02 08 50 5c 00 e2 00      49.254  READ DMA

SMART Self-test log structure revision number 1
Num  Test_Description    Status                  Remaining  LifeTime(hours)  LBA_of_first_error
# 1  Extended offline    Completed: read failure       80%     18841         0x001f807f
# 2  Extended offline    Completed: read failure       80%     18673         0x020c678a
# 3  Extended offline    Completed: read failure       80%     18505         0x020c678a
# 4  Extended offline    Completed: read failure       80%     18338         0x020c678a
# 5  Extended offline    Completed: read failure       90%     18229         0x00408f96
# 6  Extended offline    Completed: read failure       80%     18171         0x02386789
# 7  Extended offline    Completed without error       00%     18051         -
# 8  Short offline       Completed without error       00%     18051         -
# 9  Extended offline    Completed without error       00%     18003         -
#10  Extended offline    Completed without error       00%     17836         -
#11  Extended offline    Completed without error       00%     17668         -
#12  Extended offline    Completed without error       00%     17501         -
#13  Extended offline    Completed without error       00%     17334         -
#14  Extended offline    Completed without error       00%     17166         -
#15  Extended offline    Completed without error       00%     16999         -
#16  Extended offline    Completed without error       00%     16831         -
#17  Extended offline    Completed without error       00%     16664         -
#18  Extended offline    Completed without error       00%     16603         -
#19  Extended offline    Completed without error       00%     16497         -
#20  Extended offline    Completed without error       00%     16329         -
#21  Extended offline    Completed without error       00%     16163         -

