# /usr/sbin/smartctl -a -m /dev/hda
smartctl version 5.0-49 Copyright (C) 2002 Bruce Allen
Home page is http://smartmontools.sourceforge.net/

=== START OF INFORMATION SECTION ===
Device Model:     Maxtor 4R080J0                          
Serial Number:    R20BZ3LE            
Firmware Version: RAMB1TU0
ATA Version is:   7
ATA Standard is:  Unrecognized. Minor revision code: 0x1e
SMART support is: Available - device has SMART capability.
SMART support is: Enabled

=== START OF READ SMART DATA SECTION ===
SMART overall-health self-assessment test result: PASSED

General SMART Values:
Off-line data collection status: (0x82)	Offline data collection activity 
					completed without error.
Self-test execution status:      (  33)	The self-test routine was interrupted
					by the host with a hard or soft reset.
Total time to complete off-line 
data collection: 		 ( 241) seconds.
Offline data collection
capabilities: 			 (0x5b) SMART execute Offline immediate.
					Automatic timer ON/OFF support.
					Suspend Offline collection upon new
					command.
					Offline surface scan supported.
					Self-test supported.
SMART capabilities:            (0x0003)	Saves SMART data before entering
					power-saving mode.
					Supports SMART auto save timer.
Error logging capability:        (0x01)	Error logging supported.
Short self-test routine 
recommended polling time: 	 (   2) minutes.
Extended self-test routine 
recommended polling time: 	 (  41) minutes.

SMART Attributes Data Structure revision number: 16
Vendor Specific SMART Attributes with Thresholds:
ID# ATTRIBUTE_NAME          FLAG     VALUE WORST THRESH TYPE     WHEN_FAILED RAW_VALUE
  3 Spin_Up_Time            0x0027   252   252   063    Pre-fail     -       1621
  4 Start_Stop_Count        0x0032   253   253   000    Old_age      -       18
  5 Reallocated_Sector_Ct   0x0033   253   253   063    Pre-fail     -       0
  6 Read_Channel_Margin     0x0001   253   253   100    Pre-fail     -       0
  7 Seek_Error_Rate         0x000a   253   252   000    Old_age      -       0
  8 Seek_Time_Performance   0x0027   252   244   187    Pre-fail     -       41642
  9 Power_On_Hours          0x0032   253   253   000    Old_age      -       27 h + 13 m
 10 Spin_Retry_Count        0x002b   252   252   157    Pre-fail     -       0
 11 Calibration_Retry_Count 0x002b   253   252   223    Pre-fail     -       0
 12 Power_Cycle_Count       0x0032   253   253   000    Old_age      -       24
192 Power-Off_Retract_Count 0x0032   253   253   000    Old_age      -       0
193 Load_Cycle_Count        0x0032   253   253   000    Old_age      -       0
194 Temperature_Celsius     0x0032   253   253   000    Old_age      -       29
195 Hardware_ECC_Recovered  0x000a   253   252   000    Old_age      -       31004
196 Reallocated_Event_Count 0x0008   253   253   000    Old_age      -       0
197 Current_Pending_Sector  0x0008   253   253   000    Old_age      -       0
198 Offline_Uncorrectable   0x0008   253   253   000    Old_age      -       0
199 UDMA_CRC_Error_Count    0x0008   199   199   000    Old_age      -       0
200 Multi_Zone_Error_Rate   0x000a   253   252   000    Old_age      -       0
201 Unknown_Attribute       0x000a   253   252   000    Old_age      -       3
202 Unknown_Attribute       0x000a   253   252   000    Old_age      -       0
203 Unknown_Attribute       0x000b   253   252   180    Pre-fail     -       2
204 Unknown_Attribute       0x000a   253   252   000    Old_age      -       0
205 Unknown_Attribute       0x000a   253   252   000    Old_age      -       0
207 Unknown_Attribute       0x002a   252   252   000    Old_age      -       0
208 Unknown_Attribute       0x002a   252   252   000    Old_age      -       0
209 Unknown_Attribute       0x0024   079   063   000    Old_age      -       0
 99 Unknown_Attribute       0x0004   253   253   000    Old_age      -       0
100 Unknown_Attribute       0x0004   253   253   000    Old_age      -       0
101 Unknown_Attribute       0x0004   253   253   000    Old_age      -       0

SMART Error Log Version: 1
ATA Error Count: 5
	DCR = Device Control Register
	FR  = Features Register
	SC  = Sector Count Register
	SN  = Sector Number Register
	CL  = Cylinder Low Register
	CH  = Cylinder High Register
	D/H = Device/Head Register
	CR  = Content written to Command Register
	ER  = Error register
	STA = Status register
Timestamp is seconds since the previous disk power-on.
Note: timestamp "wraps" after 2^32 msec = 49.710 days.

Error 5 occurred at disk power-on lifetime: 4 hours
When the command that caused the error occurred, the device was in an unknown state.
After command completion occurred, registers were:
ER:04 SC:00 SN:00 CL:f4 CH:2c D/H:00 ST:01
Sequence of commands leading to the command that caused the error were:
DCR   FR   SC   SN   CL   CH   D/H   CR   Timestamp
 0e   d4   00   82   4f   c2    f0   b0     8907.296
 08   d4   00   82   4f   c2    f0   b0     6260.832
 08   d1   01   01   4f   c2    f0   b0     6260.800
 08   d0   01   00   4f   c2    f0   b0     6260.768
 08   da   00   00   4f   c2    10   b0     6260.736

Error 4 occurred at disk power-on lifetime: 1 hours
When the command that caused the error occurred, the device was in an unknown state.
After command completion occurred, registers were:
ER:04 SC:00 SN:00 CL:f4 CH:2c D/H:00 ST:01
Sequence of commands leading to the command that caused the error were:
DCR   FR   SC   SN   CL   CH   D/H   CR   Timestamp
 0e   d4   00   82   4f   c2    f0   b0     1944.192
 08   d4   00   82   4f   c2    f0   b0     1824.240
 08   d1   01   01   4f   c2    f0   b0     1824.224
 08   d0   01   00   4f   c2    f0   b0     1824.160
 08   00   08   3f   00   00    f0   ca     1810.400

Error 3 occurred at disk power-on lifetime: 1 hours
When the command that caused the error occurred, the device was in an unknown state.
After command completion occurred, registers were:
ER:04 SC:00 SN:00 CL:f4 CH:2c D/H:00 ST:01
Sequence of commands leading to the command that caused the error were:
DCR   FR   SC   SN   CL   CH   D/H   CR   Timestamp
 0e   d4   00   82   4f   c2    f0   b0     1456.432
 08   d4   00   82   4f   c2    f0   b0     1379.456
 08   d1   01   01   4f   c2    f0   b0     1379.440
 08   d0   01   00   4f   c2    f0   b0     1379.376
 08   00   08   f7   01   54    f0   ca     1378.544

Error 2 occurred at disk power-on lifetime: 0 hours
When the command that caused the error occurred, the device was in an unknown state.
After command completion occurred, registers were:
ER:04 SC:00 SN:00 CL:f4 CH:2c D/H:00 ST:51
Sequence of commands leading to the command that caused the error were:
DCR   FR   SC   SN   CL   CH   D/H   CR   Timestamp
 08   d4   00   82   4f   c2    f0   b0     908.320
 08   d1   01   01   4f   c2    f0   b0     908.320
 08   d0   01   00   4f   c2    f0   b0     908.272
 08   d4   00   7f   4f   c2    f0   b0     905.696
 08   d1   01   01   4f   c2    f0   b0     905.664

Error 1 occurred at disk power-on lifetime: 0 hours
When the command that caused the error occurred, the device was in an unknown state.
After command completion occurred, registers were:
ER:04 SC:50 SN:40 CL:97 CH:03 D/H:10 ST:51
Sequence of commands leading to the command that caused the error were:
DCR   FR   SC   SN   CL   CH   D/H   CR   Timestamp
 00   fe   00   00   00   00    10   ef     137.184
 00   3d   00   00   00   00    10   c3     137.136
 00   e4   00   00   00   00    10   c3     137.088
 00   3d   00   00   00   00    10   c3     137.088
 00   00   00   00   5e   20    10   70     137.040

SMART Self-test log, version number 1
Num  Test_Description    Status                  Remaining  LifeTime(hours)  LBA_of_first_error
# 1  Extended captive    Interrupted (host reset)      10%         4         
# 2  Short off-line      Completed                     00%         2         
# 3  Short captive       Completed                     00%         2         
# 4  Extended captive    Interrupted (host reset)      40%         1         
# 5  Extended captive    Interrupted (host reset)      70%         1         
# 6  Extended captive    Interrupted (host reset)      40%         0         
