smartctl version 5.30 Copyright (C) 2002-4 Bruce Allen
Home page is http://smartmontools.sourceforge.net/

=== START OF INFORMATION SECTION ===
Device Model:     WDC WD2500JB-32EVA0
Serial Number:    WD-WMAEH1156826
Firmware Version: 15.05R15
Device is:        In smartctl database [for details use: -P show]
ATA Version is:   6
ATA Standard is:  Exact ATA specification draft version not indicated
Local Time is:    Fri Jun 25 08:14:16 2004 CDT
SMART support is: Available - device has SMART capability.
SMART support is: Enabled

=== START OF READ SMART DATA SECTION ===
SMART overall-health self-assessment test result: FAILED!
Drive failure expected in less than 24 hours. SAVE ALL DATA.
See vendor-specific Attribute list for failed Attributes.

General SMART Values:
Offline data collection status:  (0x84)	Offline data collection activity was
					suspended by an interrupting command from host.
					Auto Offline Data Collection: Enabled.
Self-test execution status:      (  73)	The previous self-test completed having
					a test element that failed and the test
					element that failed is not known.
Total time to complete Offline 
data collection: 		 (7608) seconds.
Offline data collection
capabilities: 			 (0x7b) SMART execute Offline immediate.
					Auto Offline data collection on/off support.
					Suspend Offline collection upon new
					command.
					Offline surface scan supported.
					Self-test supported.
					Conveyance Self-test supported.
					Selective Self-test supported.
SMART capabilities:            (0x0003)	Saves SMART data before entering
					power-saving mode.
					Supports SMART auto save timer.
Error logging capability:        (0x01)	Error logging supported.
					No General Purpose Logging support.
Short self-test routine 
recommended polling time: 	 (   2) minutes.
Extended self-test routine
recommended polling time: 	 (  95) minutes.
Conveyance self-test routine
recommended polling time: 	 (   5) minutes.

SMART Attributes Data Structure revision number: 16
Vendor Specific SMART Attributes with Thresholds:
ID# ATTRIBUTE_NAME          FLAG     VALUE WORST THRESH TYPE      UPDATED  WHEN_FAILED RAW_VALUE
  1 Raw_Read_Error_Rate     0x000b   001   001   051    Pre-fail  Always   FAILING_NOW 2777
  3 Spin_Up_Time            0x0007   125   120   021    Pre-fail  Always       -       4283
  4 Start_Stop_Count        0x0032   100   100   040    Old_age   Always       -       133
  5 Reallocated_Sector_Ct   0x0033   199   199   140    Pre-fail  Always       -       1
  7 Seek_Error_Rate         0x000b   200   200   051    Pre-fail  Always       -       0
  9 Power_On_Hours          0x0032   092   092   000    Old_age   Always       -       6545
 10 Spin_Retry_Count        0x0013   100   100   051    Pre-fail  Always       -       0
 11 Calibration_Retry_Count 0x0013   100   100   051    Pre-fail  Always       -       0
 12 Power_Cycle_Count       0x0032   100   100   000    Old_age   Always       -       133
194 Temperature_Celsius     0x0022   128   253   000    Old_age   Always       -       22
196 Reallocated_Event_Count 0x0032   199   199   000    Old_age   Always       -       1
197 Current_Pending_Sector  0x0012   200   200   000    Old_age   Always       -       13
198 Offline_Uncorrectable   0x0012   200   200   000    Old_age   Always       -       0
199 UDMA_CRC_Error_Count    0x000a   200   253   000    Old_age   Always       -       1
200 Multi_Zone_Error_Rate   0x0009   200   155   051    Pre-fail  Offline      -       0

SMART Error Log Version: 1
ATA Error Count: 50 (device log contains only the most recent five errors)
	CR = Command Register [HEX]
	FR = Features Register [HEX]
	SC = Sector Count Register [HEX]
	SN = Sector Number Register [HEX]
	CL = Cylinder Low Register [HEX]
	CH = Cylinder High Register [HEX]
	DH = Device/Head Register [HEX]
	DC = Device Command Register [HEX]
	ER = Error register [HEX]
	ST = Status register [HEX]
Timestamp = decimal seconds since the previous disk power-on.
Note: timestamp "wraps" after 2^32 msec = 49.710 days.

Error 50 occurred at disk power-on lifetime: 1082 hours
  When the command that caused the error occurred, the device was doing SMART Offline or Self-test.

  After command completion occurred, registers were:
  ER ST SC SN CL CH DH
  -- -- -- -- -- -- --
  40 51 07 82 a9 ee e0  Error: 

  Commands leading to the command that caused the error were:
  CR FR SC SN CL CH DH DC   Timestamp  Command/Feature_Name
  -- -- -- -- -- -- -- --   ---------  --------------------
  00 00 25 00 00 07 00 00 2825901.100  NOP [Abort queued commands]
  03 00 82 00 00 5f 67 00 2825901.100  CFA REQUEST EXTENDED ERROR CODE
  00 00 25 00 00 01 00 00 2825901.100  NOP [Abort queued commands]
  00 00 25 00 00 08 00 00 2825901.100  NOP [Abort queued commands]
  12 00 ee 00 00 5f a9 00 2825901.100  RECALIBRATE [RET-4]

Error 49 occurred at disk power-on lifetime: 1082 hours
  When the command that caused the error occurred, the device was doing SMART Offline or Self-test.

  After command completion occurred, registers were:
  ER ST SC SN CL CH DH
  -- -- -- -- -- -- --
  40 51 07 82 a9 ee e0  Error: 

  Commands leading to the command that caused the error were:
  CR FR SC SN CL CH DH DC   Timestamp  Command/Feature_Name
  -- -- -- -- -- -- -- --   ---------  --------------------
  00 00 25 00 00 07 00 00 2825899.350  NOP [Abort queued commands]
  12 00 ee 00 00 7f a9 00 2825899.350  RECALIBRATE [RET-4]
  00 00 25 00 00 08 00 00 2825899.350  NOP [Abort queued commands]
  00 00 25 00 00 08 00 00 2825899.350  NOP [Abort queued commands]
  12 00 ee 00 00 5f a9 00 2825899.350  RECALIBRATE [RET-4]

Error 48 occurred at disk power-on lifetime: 1082 hours
  When the command that caused the error occurred, the device was doing SMART Offline or Self-test.

  After command completion occurred, registers were:
  ER ST SC SN CL CH DH
  -- -- -- -- -- -- --
  40 51 08 17 a9 ee e0  Error: 

  Commands leading to the command that caused the error were:
  CR FR SC SN CL CH DH DC   Timestamp  Command/Feature_Name
  -- -- -- -- -- -- -- --   ---------  --------------------
  00 00 25 00 00 08 00 00 2825880.900  NOP [Abort queued commands]
  00 00 d6 00 00 77 ad 00 2825880.900  NOP [Abort queued commands]
  00 00 25 00 00 08 00 00 2825880.900  NOP [Abort queued commands]
  00 00 d0 00 00 5f 5c 00 2825880.900  NOP [Abort queued commands]
  00 00 35 00 00 08 00 00 2825880.900  NOP [Abort queued commands]

Error 47 occurred at disk power-on lifetime: 1082 hours
  When the command that caused the error occurred, the device was doing SMART Offline or Self-test.

  After command completion occurred, registers were:
  ER ST SC SN CL CH DH
  -- -- -- -- -- -- --
  40 51 08 17 a9 ee e0  Error: 

  Commands leading to the command that caused the error were:
  CR FR SC SN CL CH DH DC   Timestamp  Command/Feature_Name
  -- -- -- -- -- -- -- --   ---------  --------------------
  00 00 25 00 00 08 00 00 2825879.000  NOP [Abort queued commands]
  00 00 d6 00 00 77 ad 00 2825879.000  NOP [Abort queued commands]
  00 00 35 00 00 08 00 00 2825879.000  NOP [Abort queued commands]
  00 00 35 00 00 08 00 00 2825879.000  NOP [Abort queued commands]
  06 00 8a 00 00 4f 3b 00 2825879.000  [RESERVED]

Error 46 occurred at disk power-on lifetime: 1082 hours
  When the command that caused the error occurred, the device was doing SMART Offline or Self-test.

  After command completion occurred, registers were:
  ER ST SC SN CL CH DH
  -- -- -- -- -- -- --
  40 51 08 c5 a8 ee e0  Error: 

  Commands leading to the command that caused the error were:
  CR FR SC SN CL CH DH DC   Timestamp  Command/Feature_Name
  -- -- -- -- -- -- -- --   ---------  --------------------
  00 00 25 00 00 08 00 00 2825875.250  NOP [Abort queued commands]
  00 00 25 00 00 08 00 00 2825875.250  NOP [Abort queued commands]
  06 00 ba 00 00 f7 66 00 2825875.250  [RESERVED]
  00 00 35 00 00 10 00 00 2825875.250  NOP [Abort queued commands]
  06 00 ba 00 00 1f 66 00 2825875.250  [RESERVED]

SMART Self-test log structure revision number 1
Num  Test_Description    Status                  Remaining  LifeTime(hours)  LBA_of_first_error
# 1  Short offline       Completed: unknown failure    90%      1077         0xfff00000
# 2  Short offline       Completed without error       00%      1053         -
# 3  Short offline       Completed without error       00%      1030         -
# 4  Short offline       Completed without error       00%      1007         -
# 5  Short offline       Completed without error       00%       983         -
# 6  Extended offline    Completed without error       00%       961         -
# 7  Short offline       Completed without error       00%       938         -
# 8  Short offline       Completed without error       00%       914         -
# 9  Short offline       Completed without error       00%       891         -
#10  Short offline       Completed without error       00%       868         -
#11  Short offline       Completed without error       00%       844         -
#12  Short offline       Completed without error       00%       821         -
#13  Extended offline    Completed without error       00%       799         -
#14  Short offline       Completed without error       00%       775         -
#15  Short offline       Completed without error       00%       752         -
#16  Short offline       Completed without error       00%       728         -
#17  Short offline       Completed without error       00%       705         -
#18  Short offline       Completed without error       00%       682         -
#19  Short offline       Completed without error       00%       659         -
#20  Extended offline    Completed without error       00%       637         -
#21  Short offline       Completed without error       00%       613         -

